productName,priceWholesale,priceDrop,description,googleDriveUrl,sku,material,sizes
Бразиліани БШ Чорний S M,123.3,250.0,Бразиліани БШ Чорний S M | Category: Бразиліани безшовні,,,,
Бразиліани БШ Графіт S M,122.4,250.0,Бразиліани БШ Графіт S M | Category: Бразиліани безшовні,,,,
Бразиліани БШ Сірий S M,125.3,250.0,Бразиліани БШ Сірий S M | Category: Бразиліани безшовні,,,,
Бразиліани БШ Малина S M,123.3,250.0,Бразиліани БШ Малина S M | Category: Бразиліани безшовні,,,,
Бразиліани БШ Персик S M,124.83,250.0,Бразиліани БШ Персик S M | Category: Бразиліани безшовні,,,,
Бразиліани БШ Свіжий голубий S M,125.78,250.0,Бразиліани БШ Свіжий голубий S M | Category: Бразиліани безшовні,,,,
Бразиліани БШ Фіолетовий S M,123.3,250.0,Бразиліани БШ Фіолетовий S M | Category: Бразиліани безшовні,,,,
Бразиліани БШ Рожевий S M,123.3,250.0,Бразиліани БШ Рожевий S M | Category: Бразиліани безшовні,,,,
Бразиліани БШ Шоколад S M,123.3,250.0,Бразиліани БШ Шоколад S M | Category: Бразиліани безшовні,,,,
Бразиліани БШ Зелений S M,123.2,250.0,Бразиліани БШ Зелений S M | Category: Бразиліани безшовні,,,,
Бразиліани БШ Синій S M,122.4,250.0,Бразиліани БШ Синій S M | Category: Бразиліани безшовні,,,,
Бразиліани БШ Хакі S M,123.3,250.0,Бразиліани БШ Хакі S M | Category: Бразиліани безшовні,,,,
Бразиліани БШ Електрик S M,124.88,250.0,Бразиліани БШ Електрик S M | Category: Бразиліани безшовні,,,,
Бразиліани БШ Ліловий S M,123.3,250.0,Бразиліани БШ Ліловий S M | Category: Бразиліани безшовні,,,,
Бразиліани БШ Червоний S M,123.3,250.0,Бразиліани БШ Червоний S M | Category: Бразиліани безшовні,,,,
Бразиліани БШ Блакитний S M,122.55,250.0,Бразиліани БШ Блакитний S M | Category: Бразиліани безшовні,,,,
Бразиліани БШ Ментол S M,123.84,250.0,Бразиліани БШ Ментол S M | Category: Бразиліани безшовні,,,,
Бразиліани БШ Білий S M,123.3,250.0,Бразиліани БШ Білий S M | Category: Бразиліани безшовні,,,,
Бразиліани БШ Беж S M,123.53,250.0,Бразиліани БШ Беж S M | Category: Бразиліани безшовні,,,,
Бразиліани БШ Мокко S M,123.3,250.0,Бразиліани БШ Мокко S M | Category: Бразиліани безшовні,,,,
Бразиліани БШ Пудра S M,128.25,250.0,Бразиліани БШ Пудра S M | Category: Бразиліани безшовні,,,,
Бразиліани БШ Марсала S M,123.3,250.0,Бразиліани БШ Марсала S M | Category: Бразиліани безшовні,,,,
Бразиліани БШ Молочний S M,123.3,250.0,Бразиліани БШ Молочний S M | Category: Бразиліани безшовні,,,,
Бразиліани БШ Шоколад L XL,123.3,250.0,Бразиліани БШ Шоколад L XL | Category: Бразиліани безшовні,,,,
Бразиліани БШ Чорний L XL,121.5,250.0,Бразиліани БШ Чорний L XL | Category: Бразиліани безшовні,,,,
Бразиліани БШ Червоний L XL,123.12,250.0,Бразиліани БШ Червоний L XL | Category: Бразиліани безшовні,,,,
Бразиліани БШ Хакі L XL,128.25,250.0,Бразиліани БШ Хакі L XL | Category: Бразиліани безшовні,,,,
Бразиліани БШ Фіолетовий L XL,121.5,250.0,Бразиліани БШ Фіолетовий L XL | Category: Бразиліани безшовні,,,,
Бразиліани БШ Сірий L XL,121.5,250.0,Бразиліани БШ Сірий L XL | Category: Бразиліани безшовні,,,,
Бразиліани БШ Синій L XL,123.3,250.0,Бразиліани БШ Синій L XL | Category: Бразиліани безшовні,,,,
Бразиліани БШ Свіжий голубий L XL,124.14,250.0,Бразиліани БШ Свіжий голубий L XL | Category: Бразиліани безшовні,,,,
Бразиліани БШ Рожевий L XL,128.25,250.0,Бразиліани БШ Рожевий L XL | Category: Бразиліани безшовні,,,,
Бразиліани БШ Пудра L XL,125.4,250.0,Бразиліани БШ Пудра L XL | Category: Бразиліани безшовні,,,,
Бразиліани БШ Персик L XL,122.4,250.0,Бразиліани БШ Персик L XL | Category: Бразиліани безшовні,,,,
Бразиліани БШ Молочний L XL,122.4,250.0,Бразиліани БШ Молочний L XL | Category: Бразиліани безшовні,,,,
Бразиліани БШ Мокко L XL,128.25,250.0,Бразиліани БШ Мокко L XL | Category: Бразиліани безшовні,,,,
Бразиліани БШ Ментол L XL,122.4,250.0,Бразиліани БШ Ментол L XL | Category: Бразиліани безшовні,,,,
Бразиліани БШ Марсала L XL,123.3,250.0,Бразиліани БШ Марсала L XL | Category: Бразиліани безшовні,,,,
Бразиліани БШ Малина L XL,124.09,250.0,Бразиліани БШ Малина L XL | Category: Бразиліани безшовні,,,,
Бразиліани БШ Ліловий L XL,123.3,250.0,Бразиліани БШ Ліловий L XL | Category: Бразиліани безшовні,,,,
Бразиліани БШ Зелений L XL,121.5,250.0,Бразиліани БШ Зелений L XL | Category: Бразиліани безшовні,,,,
Бразиліани БШ Електрик L XL,124.82,250.0,Бразиліани БШ Електрик L XL | Category: Бразиліани безшовні,,,,
Бразиліани БШ Графіт L XL,121.5,250.0,Бразиліани БШ Графіт L XL | Category: Бразиліани безшовні,,,,
Бразиліани БШ Блакитний L XL,122.55,250.0,Бразиліани БШ Блакитний L XL | Category: Бразиліани безшовні,,,,
Бразиліани БШ Білий L XL,121.5,250.0,Бразиліани БШ Білий L XL | Category: Бразиліани безшовні,,,,
Бразиліани БШ Беж L XL,121.5,250.0,Бразиліани БШ Беж L XL | Category: Бразиліани безшовні,,,,
